<?xml version="1.0" encoding="UTF-8"?>
<?xml-model href="../schema/sem.xsd"?>
<?xml-model href="../schema/sem.sch" type="application/xml" schematypens="http://purl.oclc.org/dsdl/schematron"?>
<recenze xmlns="urn:x-koubevo:schemas:restaurace" xmlns:xsi="http://www.w3.org/2001/XMLSchema-instance" xsi:schemaLocation="urn:x-koubevo:schemas:restaurace ../schema/sem.xsd">
    <restaurace>
        <id>152698</id>
        <nazev>Brambory Na Pankráci</nazev>
        <popis>Podnik se nachází v Praze na Pankráci a kromě výborného YUMMY jídla a originálního bramborového konceptu nabízí i krásný interiér a otevřenou kuchyň.</popis>
        <majitel></majitel>
        <mesto>Praha</mesto>
        <stat>Česko</stat>
        <oteviraci_doba>
            <pondeli>
                <od>11:00:00</od>
                <do>23:00:00</do>
            </pondeli>
            <utery>
                <od>10:00:00</od>
                <do>22:00:00</do>
            </utery>
            <streda zavreno="true"/>
            <ctvrtek>
                <od>11:00:00</od>
                <do>23:00:00</do>
            </ctvrtek>
            <patek>
                <od>11:00:00</od>
                <do>00:00:00</do>
            </patek>
            <sobota>
                <od>12:00:00</od>
                <do>00:00:00</do>
            </sobota>
            <nedele>
                <od>12:00:00</od>
                <do>21:00:00</do>
            </nedele>
        </oteviraci_doba>
        <menu>https://www.bramborynapankraci.cz/menu/</menu>
        <kategorie>Degustace</kategorie>
        <kategorie>Brambory</kategorie>
        <hodnoceni>
            <slovni>Jídlo a obsulha skvělé. Interiér vypadá hezky, jen se připravte na hluk. Pokud půjdete okolo, určitě doporučujeme navštívit!</slovni>
            <hvezdicky>
                <misto>4</misto>
                <obsluha>5</obsluha>
                <jidlo>5</jidlo>
                <finalni>4.5</finalni>
            </hvezdicky>
        </hodnoceni>
        <top_jidlo ref_restaurace_id="152698">
            <nazev>Hovězí degustace</nazev>
            <cena mena="CZK">458</cena>
            <foto>brambory.jpg</foto>
        </top_jidlo>
        <cena_osoba mena="CZK">500</cena_osoba>
        <platba_kartou>ano</platba_kartou>
        <qerko>ano</qerko>
        <poledni_menu>každý den</poledni_menu>
        <datum_navstevy>2024-10-10</datum_navstevy>
    </restaurace>
    <restaurace>
        <id>152699</id>
        <nazev>Pizza Paradise</nazev>
        <popis>Italská restaurace s širokou nabídkou pizz, těstovin a salátů, která se nachází v  Klášterci nad Ohří.</popis>
        <majitel>Luigi Rossi</majitel>
        <mesto>Klášterec nad Ohří</mesto>
        <stat>Česko</stat>
        <oteviraci_doba>
            <pondeli>
                <od>11:00:00</od>
                <do>22:00:00</do>
            </pondeli>
            <utery>
                <od>11:00:00</od>
                <do>22:00:00</do>
            </utery>
            <streda>
                <od>11:00:00</od>
                <do>22:00:00</do>
            </streda>
            <ctvrtek>
                <od>11:00:00</od>
                <do>22:00:00</do>
            </ctvrtek>
            <patek>
                <od>11:00:00</od>
                <do>23:00:00</do>
            </patek>
            <sobota>
                <od>12:00:00</od>
                <do>23:00:00</do>
            </sobota>
            <nedele zavreno="true">
            </nedele>
        </oteviraci_doba>
        <menu>https://www.pizzaparadise.cz</menu>
        <kategorie>Pizza</kategorie>
        <kategorie>Italská kuchyně</kategorie>
        <hodnoceni>
            <slovni>Pizza je výborná, obsluha přátelská. Doporučujeme vyzkoušet jejich domácí tiramisu!</slovni>
            <hvezdicky>
                <misto>2</misto>
                <obsluha>3</obsluha>
                <jidlo>4</jidlo>
                <finalni>3</finalni>
            </hvezdicky>
        </hodnoceni>
        <top_jidlo ref_restaurace_id="152699">
            <nazev>Margarita</nazev>
            <cena mena="CZK">150</cena>
            <foto>pizza.jpg</foto>
        </top_jidlo>
        <cena_osoba mena="CZK">300</cena_osoba>
        <platba_kartou>ano</platba_kartou>
        <qerko>ne</qerko>
        <poledni_menu>pracovní dny</poledni_menu>
        <datum_navstevy>2024-11-20</datum_navstevy>
    </restaurace>
    <restaurace>
        <id>152700</id>
        <nazev>Café Imperial</nazev>
        <popis>Ikonická restaurace v Praze, známá pro svůj krásný interiér ve stylu art deco.</popis>
        <majitel>Zdeněk Polreich</majitel>
        <mesto>Praha</mesto>
        <stat>Česko</stat>
        <oteviraci_doba>
            <pondeli>
                <od>07:00:00</od>
                <do>23:00:00</do>
            </pondeli>
            <utery>
                <od>07:00:00</od>
                <do>23:00:00</do>
            </utery>
            <streda>
                <od>07:00:00</od>
                <do>23:00:00</do>
            </streda>
            <ctvrtek>
                <od>07:00:00</od>
                <do>23:00:00</do>
            </ctvrtek>
            <patek>
                <od>07:00:00</od>
                <do>23:00:00</do>
            </patek>
            <sobota>
                <od>07:00:00</od>
                <do>23:00:00</do>
            </sobota>
            <nedele>
                <od>07:00:00</od>
                <do>23:00:00</do>
            </nedele>
        </oteviraci_doba>
        <menu>https://www.cafeimperial.cz/jidelni-listek-2/</menu>
        <kategorie>Světová kuchyně</kategorie>
        <kategorie>Luxusní restaurace</kategorie>
        <hodnoceni>
            <slovni>Předkrmy dobré, hlavní chody skvělé, dezerty dokonalé. Doporučujeme rezervaci!</slovni>
            <hvezdicky>
                <misto>5</misto>
                <obsluha>5</obsluha>
                <jidlo>5</jidlo>
                <finalni>5</finalni>
            </hvezdicky>
        </hodnoceni>
        <top_jidlo ref_restaurace_id="152700">
            <nazev>Čokoládový fondant</nazev>
            <cena mena="CZK">120</cena>
            <foto>imperial.jpg</foto>
        </top_jidlo>
        <cena_osoba mena="CZK">1000</cena_osoba>
        <platba_kartou>ano</platba_kartou>
        <qerko>ne</qerko>
        <poledni_menu>každý den</poledni_menu>
        <datum_navstevy>2024-12-05</datum_navstevy>
    </restaurace>
    <restaurace>
        <id>152701</id>
        <nazev>Goldies</nazev>
        <popis>Nejlepší burgery v Praze. Sedněte na Hlaváku do vlaku, za 4 hoďky jste v Berlíně a šup na Goldies!</popis>
        <majitel>Anna Müller</majitel>
        <mesto>Berlín</mesto>
        <stat>Německo</stat>
        <oteviraci_doba>
            <pondeli>
                <od>12:00:00</od>
                <do>22:00:00</do>
            </pondeli>
            <utery>
                <od>12:00:00</od>
                <do>22:00:00</do>
            </utery>
            <streda>
                <od>12:00:00</od>
                <do>22:00:00</do>
            </streda>
            <ctvrtek>
                <od>12:00:00</od>
                <do>22:00:00</do>
            </ctvrtek>
            <patek>
                <od>12:00:00</od>
                <do>00:00:00</do>
            </patek>
            <sobota>
                <od>12:00:00</od>
                <do>00:00:00</do>
            </sobota>
            <nedele>
                <od>12:00:00</od>
                <do>22:00:00</do>
            </nedele>
        </oteviraci_doba>
        <menu>https://www.goldies-smashburger.de/#Menu</menu>
        <kategorie>Burgery</kategorie>
        <hodnoceni>
            <slovni>Nejlepší smashburgery, co jsme kdy zkusili! Místo je nonstop plné, ale obsaluha je super rychlá.</slovni>
            <hvezdicky>
                <misto>4</misto>
                <obsluha>5</obsluha>
                <jidlo>5</jidlo>
                <finalni>5</finalni>
            </hvezdicky>
        </hodnoceni>
        <top_jidlo ref_restaurace_id="152701">
            <nazev>Super Smash BLT Double</nazev>
            <cena mena="EUR">25</cena>
            <foto>goldies.jpg</foto>
        </top_jidlo>
        <cena_osoba mena="EUR">25</cena_osoba>
        <platba_kartou>ano</platba_kartou>
        <qerko>ne</qerko>
        <poledni_menu>ne</poledni_menu>
        <datum_navstevy>2024-06-06</datum_navstevy>
    </restaurace>
</recenze>